"danish","swedish","pos","example_da","example_sv","note","deck","cefr","tags","audio","audio_example"
"snildt","enkelt, lätt, smidigt","adv","Det klarede vi snildt.","Det klarade vi enkelt.","VARNING falsk vän: adj. 'snild' är besläktat med svenskans 'snäll' men betyder INTE snäll. Adv. 'snildt' = lätt/utan problem; adj. 'snild' = smart/fyndig/listig. Sv. 'snäll' (rar) heter på danska 'sød/rar'.","falske-venner-b1","b2","falsk-ven|asymmetrisk","audio/da-02df0c6e552136.mp3","audio/da-02df0c6e552136-ex.mp3"
"frokost","lunch","noun","Vi spiser frokost klokken tolv.","Vi äter lunch klockan tolv.","En-ord: 'en frokost'. Falsk vän: betyder LUNCH, inte frukost. Frukost heter 'morgenmad'.","mad-og-restaurant-b1","b1","mad|falsk-ven|asymmetrisk","audio/da-095ff6b57a0ed0.mp3","audio/da-095ff6b57a0ed0-ex.mp3"
"morgenmad","frukost","noun","Jeg fik havregryn til morgenmad.","Jag åt havregryn till frukost.","En-ord: 'en morgenmad' (oftast i bestämd form 'morgenmaden'). OBS: det är frukost som heter 'morgenmad', inte 'frokost' (= lunch).","mad-og-restaurant-b1","b1","mad","audio/da-12deb93716eb05.mp3","audio/da-12deb93716eb05-ex.mp3"
"aftensmad","middag (kvällsmat)","noun","Hvad skal vi have til aftensmad?","Vad ska vi ha till middag?","En-ord: 'en aftensmad'. Tydligaste ordet för kvällsmålet. Synonym: 'middag'.","mad-og-restaurant-b1","b1","mad","audio/da-0b1fa411bd86c2.mp3","audio/da-0b1fa411bd86c2-ex.mp3"
"middag","middag","noun","Vi inviterede dem til middag i aften.","Vi bjöd dem på middag i kväll.","En-ord: 'en middag'. Betyder oftast kvällsmaten (som svenskans middag). Kan regionalt även betyda mitt på dagen.","mad-og-restaurant-b1","b1","mad","audio/da-023440a90daf9c.mp3","audio/da-023440a90daf9c-ex.mp3"
"ret","maträtt","noun","Dagens ret er stegt flæsk.","Dagens rätt är stekt fläsk.","En-ord: 'en ret'. Delvis falsk vän: betyder maträtt. 'Ret' kan också betyda 'rättighet' eller, som adverb, 'ganska'.","mad-og-restaurant-b1","b1","mad|falsk-ven|asymmetrisk","audio/da-1ff019c570cdc4.mp3","audio/da-1ff019c570cdc4-ex.mp3"
"forret","förrätt","noun","Som forret tog vi suppe.","Som förrätt tog vi soppa.","En-ord: 'en forret'. Bildat av 'for-' + 'ret' (maträtt). Stavas med ett 'r' i 'for-': forret.","mad-og-restaurant-b1","b1","mad|stavning","audio/da-0b204dacde9071.mp3","audio/da-0b204dacde9071-ex.mp3"
"hovedret","varmrätt, huvudrätt","noun","Til hovedret valgte jeg fisk.","Till varmrätt valde jag fisk.","En-ord: 'en hovedret'. 'Hoved' = huvud; 'd' är stumt/blødt d, uttalas ungefär 'ho-el'.","mad-og-restaurant-b1","b1","mad","audio/da-1a7ca6392fb3e9.mp3","audio/da-1a7ca6392fb3e9-ex.mp3"
"regning","nota, räkning","noun","Må jeg bede om regningen?","Kan jag få notan?","En-ord: 'en regning'. På restaurang = notan. 'Bede om' (infinitiv 'at bede om') = be om.","mad-og-restaurant-b1","b1","mad","audio/da-068fbad284cfd6.mp3","audio/da-068fbad284cfd6-ex.mp3"
"bestille","beställa","verb","Vi vil gerne bestille nu.","Vi vill gärna beställa nu.","Infinitiv 'at bestille'. Kan också betyda 'göra/uträtta': 'Hvad bestiller du?' = Vad håller du på med?","mad-og-restaurant-b1","b1","mad","audio/da-0e1e0d8eeb23b4.mp3","audio/da-0e1e0d8eeb23b4-ex.mp3"
"tjener","servitör, kypare","noun","Tjeneren kom med menukortet.","Servitören kom med menyn.","En-ord: 'en tjener'. Bildat av 'at tjene' (tjäna). 'Menukort' = menyn.","mad-og-restaurant-b1","b1","mad","audio/da-04b4767e6a52f9.mp3","audio/da-04b4767e6a52f9-ex.mp3"
"smage","smaka","verb","Maden smager virkelig godt.","Maten smakar verkligen gott.","Infinitiv 'at smage'. Presens 'smager'. Stavas med 'g' där svenskan har 'k'.","mad-og-restaurant-b1","b1","mad|stavning","audio/da-04b6bcfd76c290.mp3","audio/da-04b6bcfd76c290-ex.mp3"
"lækker","god, läcker","adj","Desserten var virkelig lækker.","Desserten var verkligen god.","Om mat = gott/läckert (t-form 'lækkert'). Asymmetrisk falsk vän: om en person betyder 'lækker' snygg/attraktiv, vilket svenskans 'läcker' normalt inte säger.","mad-og-restaurant-b1","b1","mad|falsk-ven|asymmetrisk","audio/da-04abacbb09f202.mp3","audio/da-04abacbb09f202-ex.mp3"
"bord","bord","noun","Vi har bestilt bord til fire.","Vi har bokat bord för fyra.","Et-ord: 'et bord'. 'Bestille bord' = boka bord. OBS genus: heter 'et bord', inte 'en'.","mad-og-restaurant-b1","b1","mad","audio/da-113cc93b8dcb67.mp3","audio/da-113cc93b8dcb67-ex.mp3"
"indkøb","inköp, handling","noun","Jeg skal lige ud og handle ind.","Jag ska bara ut och handla.","Et-ord: 'et indkøb'. Verbet 'at handle ind' = att handla mat.","mad-og-restaurant-b1","b1","mad","audio/da-05c36176f68765.mp3","audio/da-05c36176f68765-ex.mp3"
"kvittering","kvitto","noun","Vil du have kvitteringen med?","Vill du ha kvittot med dig?","En-ord: 'en kvittering'. Genusfälla: danska är en-ord, men svenskans 'kvitto' är ett-ord.","mad-og-restaurant-b1","b1","mad","audio/da-09282105362a46.mp3","audio/da-09282105362a46-ex.mp3"
"pose","påse","noun","Vil du have en pose til det?","Vill du ha en påse till det?","En-ord: 'en pose'. Danska 'o' där svenskan har 'å'.","mad-og-restaurant-b1","b1","mad|stavning","audio/da-0c6604d2eee4a7.mp3","audio/da-0c6604d2eee4a7-ex.mp3"
"tilbud","erbjudande, extrapris","noun","Kaffen er på tilbud i denne uge.","Kaffet är på extrapris den här veckan.","Et-ord: 'et tilbud'. 'På tilbud' = på extrapris/rea. Jämför 'udsalg' = rea/realisation.","mad-og-restaurant-b1","b1","mad","audio/da-14d715e07c0b15.mp3","audio/da-14d715e07c0b15-ex.mp3"
"kasse","kassa","noun","Der er lang kø ved kassen.","Det är lång kö vid kassan.","En-ord: 'en kasse'. Betyder både kassan (i butik) och 'låda'.","mad-og-restaurant-b1","b1","mad","audio/da-1d7c6ef297761a.mp3","audio/da-1d7c6ef297761a-ex.mp3"
"tog","tåg","noun","Toget til Aarhus kører fra spor 3.","Tåget till Aarhus går från spår 3.","Et-ord: et tog. Uttalas ungefär ""to'"" – det skrivna g:et hörs knappt.","rejser-og-transport-b1","b1","rejser","audio/da-04899ae550f1cb.mp3","audio/da-04899ae550f1cb-ex.mp3"
"fly","flyg","noun","Vores fly er forsinket en time.","Vårt flyg är försenat en timme.","Et-ord: et fly. Kan också vara verbet at flyve (att flyga).","rejser-og-transport-b1","b1","rejser","audio/da-140513a5d1d847.mp3","audio/da-140513a5d1d847-ex.mp3"
"lufthavn","flygplats","noun","Vi mødes i lufthavnen klokken syv.","Vi möts på flygplatsen klockan sju.","En-ord: en lufthavn. Ordagrant ""lufthamn"" – danskan säger inte ""flyveplads"" i vardagligt tal.","rejser-og-transport-b1","b1","rejser","audio/da-1f0fabef6add00.mp3","audio/da-1f0fabef6add00-ex.mp3"
"billet","biljett","noun","Jeg har købt en billet til København.","Jag har köpt en biljett till Köpenhamn.","En-ord: en billet. Stavas med dubbelt l och ett t – jämför svenskans biljett.","rejser-og-transport-b1","b1","rejser|stavning","audio/da-16035f709ba3e3.mp3","audio/da-16035f709ba3e3-ex.mp3"
"afgang","avgång","noun","Næste afgang er om ti minutter.","Nästa avgång är om tio minuter.","En-ord: en afgang. Stavas med f där svenskan har v.","rejser-og-transport-b1","b1","rejser|stavning","audio/da-009046118840f7.mp3","audio/da-009046118840f7-ex.mp3"
"ankomst","ankomst","noun","Ankomsten er planlagt til klokken tre.","Ankomsten är planerad till klockan tre.","En-ord: en ankomst.","rejser-og-transport-b1","b1","rejser","audio/da-1564c7bcc07a83.mp3","audio/da-1564c7bcc07a83-ex.mp3"
"perron","perrong","noun","Toget holder ved perron to.","Tåget står vid perrong två.","En-ord: en perron. Stavas utan g på slutet, till skillnad från svenskans perrong.","rejser-og-transport-b1","b1","rejser|stavning","audio/da-020e4fe2f4826f.mp3","audio/da-020e4fe2f4826f-ex.mp3"
"spor","spår","noun","Fra hvilket spor kører toget?","Från vilket spår går tåget?","Et-ord: et spor. Används om tågspår på stationen.","rejser-og-transport-b1","b1","rejser","audio/da-1ccdabc4fd3f44.mp3","audio/da-1ccdabc4fd3f44-ex.mp3"
"forsinkelse","försening","noun","Der er en forsinkelse på tyve minutter.","Det är en försening på tjugo minuter.","En-ord: en forsinkelse. Adjektivet är forsinket (försenad).","rejser-og-transport-b1","b1","rejser","audio/da-1afa0fce4ccf7c.mp3","audio/da-1afa0fce4ccf7c-ex.mp3"
"skifte","byta (tåg/buss)","verb","Du skal skifte i Roskilde.","Du måste byta i Roskilde.","Infinitiv: at skifte. Om tåg/buss betyder det ""byta"" – inte svenskans ""skifta"".","rejser-og-transport-b1","b1","rejser|falsk-ven|asymmetrisk","audio/da-043a177d87a44a.mp3","audio/da-043a177d87a44a-ex.mp3"
"rejsekort","resekort (för kollektivtrafik)","noun","Husk at tjekke dit rejsekort ind.","Kom ihåg att checka in ditt resekort.","Et-ord: et rejsekort. Det danska betalkortet för buss och tåg.","rejser-og-transport-b1","b1","rejser","audio/da-097906ef7d37f9.mp3","audio/da-097906ef7d37f9-ex.mp3"
"bus","buss","noun","Bussen kommer om fem minutter.","Bussen kommer om fem minuter.","En-ord: en bus. Stavas med ett s, till skillnad från svenskans buss.","rejser-og-transport-b1","b1","rejser|stavning","audio/da-1bf37cf24429e1.mp3","audio/da-1bf37cf24429e1-ex.mp3"
"stoppested","hållplats","noun","Vi står af ved næste stoppested.","Vi går av vid nästa hållplats.","Et-ord: et stoppested. Ordagrant ""stoppställe"".","rejser-og-transport-b1","b1","rejser","audio/da-1b7bff78478ec3.mp3","audio/da-1b7bff78478ec3-ex.mp3"
"færge","färja","noun","Vi tager færgen over til Sverige.","Vi tar färjan över till Sverige.","En-ord: en færge. Stavas med æ och g där svenskan har ä och j.","rejser-og-transport-b1","b1","rejser|stavning","audio/da-187b4ae29cd202.mp3","audio/da-187b4ae29cd202-ex.mp3"
"cykel","cykel","noun","I København tager mange cyklen på arbejde.","I Köpenhamn tar många cykeln till jobbet.","En-ord: en cykel. Plural: cykler.","rejser-og-transport-b1","b1","rejser","audio/da-09bc1337eee664.mp3","audio/da-09bc1337eee664-ex.mp3"
"rejse","resa (verb)","verb","Vi rejser til udlandet hver sommer.","Vi reser utomlands varje sommar.","Infinitiv: at rejse. Obs: rejse sig betyder ""resa sig"" (ställa sig upp).","rejser-og-transport-b1","b1","rejser","audio/da-06e7ad09f8a18e.mp3","audio/da-06e7ad09f8a18e-ex.mp3"
"bagage","bagage","noun","Min bagage er allerede tjekket ind.","Mitt bagage är redan incheckat.","En-ord på danska: en bagage (bagagen). På svenska är det däremot ett ord (bagaget) – obs olikt genus.","rejser-og-transport-b1","b1","rejser","audio/da-0313df331683d1.mp3","audio/da-0313df331683d1-ex.mp3"
"udlandet","utlandet","noun","Hun bor i udlandet nu.","Hon bor utomlands nu.","Bestämd form av et-ordet udland. Stavas med d där svenskan har t.","rejser-og-transport-b1","b1","rejser|stavning","audio/da-04484494d3b2e2.mp3","audio/da-04484494d3b2e2-ex.mp3"
"møde","möte","noun","Vi har et møde klokken ti.","Vi har ett möte klockan tio.","Et-ord: 'et møde'. Stavas med ø och blødt d. Kan även vara verbet 'at møde' = att möta.","arbejde-b2","b1","arbejde|stavning","audio/da-065f702a0889d0.mp3","audio/da-065f702a0889d0-ex.mp3"
"frist","deadline, tidsgräns","noun","Fristen for ansøgningen er på fredag.","Deadline för ansökan är på fredag.","En-ord: 'en frist'. Falsk vän: danskt 'frist' = deadline/tidsgräns, INTE svensk frist (anstånd/uppskov).","arbejde-b2","b2","arbejde|falsk-ven|asymmetrisk","audio/da-0c4df7cd760c9b.mp3","audio/da-0c4df7cd760c9b-ex.mp3"
"ferie","semester, ledighet","noun","Jeg holder ferie i tre uger til sommer.","Jag har semester i tre veckor till sommaren.","En-ord: 'en ferie'. Falsk vän: danskt 'ferie' = semester/ledighet generellt, inte bara skollov som svensk ferie. Svenskans 'semester' heter 'ferie' på danska.","arbejde-b2","b1","arbejde|falsk-ven|asymmetrisk","audio/da-144a24f2db59e5.mp3","audio/da-144a24f2db59e5-ex.mp3"
"fyre","avskeda, sparka","verb","De var nødt til at fyre tre medarbejdere.","De var tvungna att avskeda tre medarbetare.","Infinitiv: 'at fyre'. Falsk vän: låter som svenskans 'fyra/fira' men betyder avskeda. 'Han blev fyret' = han fick sparken.","arbejde-b2","b2","arbejde|falsk-ven|asymmetrisk","audio/da-0dd14f78f4d14c.mp3","audio/da-0dd14f78f4d14c-ex.mp3"
"ansat","anställd","noun","Virksomheden har over hundrede ansatte.","Företaget har över hundra anställda.","En-ord: 'en ansat', plural 'ansatte'. Används även som particip: 'at være ansat' = att vara anställd.","arbejde-b2","b1","arbejde","audio/da-14949c11cd71f5.mp3","audio/da-14949c11cd71f5-ex.mp3"
"kollega","kollega","noun","Min kollega hjælper mig med opgaven.","Min kollega hjälper mig med uppgiften.","En-ord: 'en kollega', plural 'kolleger' eller 'kollegaer'.","arbejde-b2","b1","arbejde","audio/da-0917a39747f24d.mp3","audio/da-0917a39747f24d-ex.mp3"
"chef","chef","noun","Jeg skal tale med min chef i morgen.","Jag ska prata med min chef imorgon.","En-ord: 'en chef'. Uttalas med 'sj'-ljud, ungefär 'sjef'.","arbejde-b2","b1","arbejde","audio/da-15fdd8e8b7cbef.mp3","audio/da-15fdd8e8b7cbef-ex.mp3"
"løn","lön","noun","Hun fik en højere løn efter forfremmelsen.","Hon fick en högre lön efter befordran.","En-ord: 'en løn'. Stavas med ø: svenskt ö blir ø på danska.","arbejde-b2","b1","arbejde|stavning","audio/da-098325d75f8a30.mp3","audio/da-098325d75f8a30-ex.mp3"
"ansøgning","ansökan","noun","Jeg sendte min ansøgning i sidste uge.","Jag skickade min ansökan förra veckan.","En-ord: 'en ansøgning'. Verbet är 'at ansøge' = att ansöka. Stavas med ø.","arbejde-b2","b2","arbejde|stavning","audio/da-0b7886bf37595f.mp3","audio/da-0b7886bf37595f-ex.mp3"
"opgave","uppgift","noun","Den her opgave er svær at løse.","Den här uppgiften är svår att lösa.","En-ord: 'en opgave'. Notera danskt 'op' där svenskan har 'upp'.","arbejde-b2","b1","arbejde","audio/da-12b72b08f9567b.mp3","audio/da-12b72b08f9567b-ex.mp3"
"fuldtid","heltid","noun","Hun arbejder på fuld tid.","Hon arbetar på heltid.","En-ord: 'en fuldtid'. 'Fuld' = full/hel; svenskt 'hel-' blir 'fuld-' här, inte 'heltid'. I uttrycket skrivs ofta 'på fuld tid' i to ord.","arbejde-b2","b2","arbejde","audio/da-0bfb969b2f8b30.mp3","audio/da-0bfb969b2f8b30-ex.mp3"
"deltid","deltid","noun","Han er ansat på deltid.","Han är anställd på deltid.","En-ord: 'en deltid'. Samma som svenska, men uttalas med blødt d i slutet.","arbejde-b2","b2","arbejde","audio/da-14eccc62d548b1.mp3","audio/da-14eccc62d548b1-ex.mp3"
"overarbejde","övertid","noun","Der er meget overarbejde i denne uge.","Det är mycket övertid den här veckan.","Et-ord: 'et overarbejde'. Obs: svenskt 'övertid' heter 'overarbejde', inte 'overtid'.","arbejde-b2","b2","arbejde","audio/da-1e75ab2d86e83e.mp3","audio/da-1e75ab2d86e83e-ex.mp3"
"vikar","vikarie","noun","Vi får en vikar, mens hun er på barsel.","Vi får en vikarie medan hon är föräldraledig.","En-ord: 'en vikar'. Kortare form än svenskans 'vikarie'.","arbejde-b2","b2","arbejde","audio/da-0242a4290068e5.mp3","audio/da-0242a4290068e5-ex.mp3"
"arbejdsplads","arbetsplats","noun","Det er en god arbejdsplads med søde kolleger.","Det är en bra arbetsplats med trevliga kollegor.","En-ord: 'en arbejdsplads'. 'Arbejd-' med j där svenskan har 'arbet-'.","arbejde-b2","b1","arbejde|stavning","audio/da-12ed5cb4421c0e.mp3","audio/da-12ed5cb4421c0e-ex.mp3"
"sygemelde sig","sjukanmäla sig","phrase","Jeg er nødt til at sygemelde mig i dag.","Jag måste sjukanmäla mig idag.","Reflexivt verb: 'at sygemelde sig'. 'Syg' = sjuk; svenskt 'sjuk-' blir 'syge-'.","arbejde-b2","b2","arbejde|fras","audio/da-1f90b7aa130db4.mp3","audio/da-1f90b7aa130db4-ex.mp3"
"hoved","huvud","noun","Jeg har ondt i hovedet.","Jag har ont i huvudet.","Et-ord: 'et hoved'. Slut-d:t är stumt, ordet uttalas ungefär 'houe'.","krop-og-sundhed-b1","b1","krop|noun","audio/da-198b138fdc9c66.mp3","audio/da-198b138fdc9c66-ex.mp3"
"hals","hals","noun","Jeg har ondt i halsen.","Jag har ont i halsen.","En-ord: 'en hals'. Fungerar precis som svenska 'hals' – 'ondt i halsen' = ont i halsen. (Nacken bakom heter 'nakken'.)","krop-og-sundhed-b1","b1","krop|noun","audio/da-1dd7210f5818ac.mp3","audio/da-1dd7210f5818ac-ex.mp3"
"mave","mage","noun","Hun har ondt i maven.","Hon har ont i magen.","En-ord: 'en mave'. Stavas med v där svenskan har g (mage → mave).","krop-og-sundhed-b1","b1","krop|stavning","audio/da-1f731a8ad7f33d.mp3","audio/da-1f731a8ad7f33d-ex.mp3"
"ryg","rygg","noun","Min ryg gør ondt efter løbeturen.","Min rygg gör ont efter löprundan.","En-ord: 'en ryg'. Danskan har bara ett g (rygg → ryg).","krop-og-sundhed-b1","b1","krop|stavning","audio/da-060b0ffe79db89.mp3","audio/da-060b0ffe79db89-ex.mp3"
"ben","ben","noun","Jeg slog mit ben, da jeg faldt.","Jag slog benet när jag föll.","Et-ord: 'et ben'. Betyder både benet man går på och knogle – precis som svenska 'ben', så ingen fälla.","krop-og-sundhed-b1","b1","krop|noun","audio/da-00963d0f3496cd.mp3","audio/da-00963d0f3496cd-ex.mp3"
"knæ","knä","noun","Hun faldt og slog sit knæ.","Hon föll och slog i knät.","Et-ord: 'et knæ'. Svenskt ä blir æ (knä → knæ).","krop-og-sundhed-b1","b1","krop|stavning","audio/da-0a1322d60458c1.mp3","audio/da-0a1322d60458c1-ex.mp3"
"have ondt i","ha ont i","phrase","Jeg har ondt i ryggen.","Jag har ont i ryggen.","Fast konstruktion: 'have ondt i' + kroppsdel. 'ondt' motsvarar svenskt 'ont'.","krop-og-sundhed-b1","b1","krop|fras","audio/da-1c70ae30dc83cb.mp3","audio/da-1c70ae30dc83cb-ex.mp3"
"feber","feber","noun","Barnet har høj feber.","Barnet har hög feber.","En-ord: 'en feber'. Samma ord som på svenska.","krop-og-sundhed-b1","b1","krop|noun","audio/da-1b049be84c0ba2.mp3","audio/da-1b049be84c0ba2-ex.mp3"
"hoste","hosta","verb","Han hoster meget om natten.","Han hostar mycket på natten.","Infinitiv: 'at hoste'. Kan också vara substantiv: 'en hoste' (en-ord) = en hosta.","krop-og-sundhed-b1","b1","krop|verb","audio/da-049f130452188d.mp3","audio/da-049f130452188d-ex.mp3"
"forkølet","förkyld","adj","Jeg er forkølet og snøfter.","Jag är förkyld och snörvlar.","Adjektiv. Att bli förkyld = 'at blive forkølet'. Notera ändelsen -et (inte svenskans -d).","krop-og-sundhed-b1","b1","krop|stavning","audio/da-09a5626e2862a9.mp3","audio/da-09a5626e2862a9-ex.mp3"
"syg","sjuk","adj","Jeg blev syg i weekenden.","Jag blev sjuk i helgen.","Adjektiv. Sjuk → syg. Uttalas med blødt g, nästan som 'sy'.","krop-og-sundhed-b1","b1","krop|stavning","audio/da-0b4686b3ad3f10.mp3","audio/da-0b4686b3ad3f10-ex.mp3"
"sygdom","sjukdom","noun","Det er en alvorlig sygdom.","Det är en allvarlig sjukdom.","En-ord: 'en sygdom'. Sjukdom → sygdom (jämför syg = sjuk).","krop-og-sundhed-b1","b1","krop|stavning","audio/da-03d94760ca66a3.mp3","audio/da-03d94760ca66a3-ex.mp3"
"læge","läkare","noun","Du bør gå til lægen.","Du borde gå till läkaren.","En-ord: 'en læge'. Förväxla inte med 'at lege' (att leka) – nästan samma stavning, helt olika betydelse.","krop-og-sundhed-b1","b1","krop|falsk-ven|asymmetrisk","audio/da-0d1eece9fcc092.mp3","audio/da-0d1eece9fcc092-ex.mp3"
"medicin","medicin","noun","Lægen gav mig noget medicin.","Läkaren gav mig medicin.","En-ord: 'en medicin'. Samma ord som på svenska.","krop-og-sundhed-b1","b1","krop|noun","audio/da-19df8797eb31ce.mp3","audio/da-19df8797eb31ce-ex.mp3"
"recept","recept","noun","Den medicin kræver et recept.","Den medicinen kräver ett recept.","Et-ord: 'et recept' (inte 'en recept'!). Används både om matrecept och läkarrecept.","krop-og-sundhed-b1","b1","krop|noun","audio/da-19088312a8f8c2.mp3","audio/da-19088312a8f8c2-ex.mp3"
"sundhed","hälsa","noun","Motion er godt for sundheden.","Motion är bra för hälsan.","En-ord: 'en sundhed'. Ordagrant 'sundhet' – svenskan saknar denna form och säger 'hälsa'.","krop-og-sundhed-b1","b1","krop|noun","audio/da-15914a6215c018.mp3","audio/da-15914a6215c018-ex.mp3"
"blodtryk","blodtryck","noun","Lægen målte mit blodtryk.","Läkaren mätte mitt blodtryck.","Et-ord: 'et blodtryk'. Danskan har bara ett k på slutet (tryck → tryk).","krop-og-sundhed-b1","b1","krop|stavning","audio/da-1fa0d668b8fb73.mp3","audio/da-1fa0d668b8fb73-ex.mp3"
"stue","vardagsrum","noun","Vi sad i stuen og så fjernsyn.","Vi satt i vardagsrummet och såg på tv.","En-ord: 'en stue'. STARK falsk vän: betyder vardagsrum (och i sammansättningar våningsplan), INTE svensk stuga. Stuga = sommerhus/hytte.","hjem-og-familie-b1","b1","hjem|falsk-ven|asymmetrisk","audio/da-0a3b2f8acedca2.mp3","audio/da-0a3b2f8acedca2-ex.mp3"
"stueetage","bottenvåning","noun","Lejligheden ligger i stueetagen.","Lägenheten ligger på bottenvåningen.","En-ord: 'en stueetage'. 'Stue-' = bottenplan; 'første sal' är en trappa upp, inte bottenvåningen.","hjem-og-familie-b1","b1","hjem","audio/da-0fa8f2df6efab3.mp3","audio/da-0fa8f2df6efab3-ex.mp3"
"værelse","rum","noun","Barnet har sit eget værelse.","Barnet har sitt eget rum.","Et-ord: 'et værelse'. Används om sov-/bostadsrum. Danska 'rum' kan också betyda rum, men 'værelse' är standardordet för ett rum i bostaden.","hjem-og-familie-b1","b1","hjem","audio/da-0c517e4f1888b0.mp3","audio/da-0c517e4f1888b0-ex.mp3"
"lejlighed","lägenhet","noun","De har købt en lejlighed i byen.","De har köpt en lägenhet i staden.","En-ord: 'en lejlighed'. Kan även betyda 'tillfälle' (ved lejlighed = vid tillfälle).","hjem-og-familie-b1","b1","hjem","audio/da-1ff36e0f8c7d71.mp3","audio/da-1ff36e0f8c7d71-ex.mp3"
"bolig","bostad","noun","Det er svært at finde en bolig i København.","Det är svårt att hitta en bostad i Köpenhamn.","En-ord: 'en bolig'. Samlingsord för bostad (hus eller lägenhet).","hjem-og-familie-b1","b1","hjem","audio/da-0680dc4e8bf6a4.mp3","audio/da-0680dc4e8bf6a4-ex.mp3"
"køkken","kök","noun","Hun laver mad i køkkenet.","Hon lagar mat i köket.","Et-ord: 'et køkken'. Stavas med 'kk' och 'ø' – inte som svenska 'kök'.","hjem-og-familie-b1","b1","hjem|stavning","audio/da-02272cc59e8cb9.mp3","audio/da-02272cc59e8cb9-ex.mp3"
"badeværelse","badrum","noun","Badeværelset er lige nyt.","Badrummet är helt nytt.","Et-ord: 'et badeværelse'. Byggs med -værelse, inte -rum (svenska 'badrum').","hjem-og-familie-b1","b1","hjem","audio/da-189d4d97e37aa1.mp3","audio/da-189d4d97e37aa1-ex.mp3"
"soveværelse","sovrum","noun","Vi maler soveværelset i weekenden.","Vi målar sovrummet i helgen.","Et-ord: 'et soveværelse'. Av 'sove' (sova) + 'værelse' (rum).","hjem-og-familie-b1","b1","hjem","audio/da-1860e6a085ef56.mp3","audio/da-1860e6a085ef56-ex.mp3"
"nabo","granne","noun","Vores nabo er meget venlig.","Vår granne är väldigt vänlig.","En-ord: 'en nabo'. Helt annat ord än svenska 'granne' – värt att lära in.","hjem-og-familie-b1","b1","hjem","audio/da-0cf1b275f59c8b.mp3","audio/da-0cf1b275f59c8b-ex.mp3"
"forældre","föräldrar","noun","Mine forældre bor på landet.","Mina föräldrar bor på landet.","Pluralord (plurale tantum): 'forældre'. En förälder = 'en forælder'.","hjem-og-familie-b1","b1","hjem","audio/da-0b9b90faf8f556.mp3","audio/da-0b9b90faf8f556-ex.mp3"
"søskende","syskon","noun","Har du nogen søskende?","Har du några syskon?","Et-ord, samma form i singular och plural: 'et søskende', flere 'søskende'. Stavas med 'ø'.","hjem-og-familie-b1","b1","hjem|stavning","audio/da-142f82c0927094.mp3","audio/da-142f82c0927094-ex.mp3"
"svigermor","svärmor","noun","Min svigermor kommer på besøg.","Min svärmor kommer på besök.","En-ord: 'en svigermor'. Förledet 'sviger-' = svenskans 'svär-': svigerfar, svigerinde (svägerska).","hjem-og-familie-b1","b1","hjem","audio/da-0976e445e8316b.mp3","audio/da-0976e445e8316b-ex.mp3"
"barnebarn","barnbarn","noun","De passer deres barnebarn om fredagen.","De passar sitt barnbarn på fredagarna.","Et-ord: 'et barnebarn', plural 'børnebørn'. Obs det extra 'e' i mitten jämfört med svenska.","hjem-og-familie-b1","b1","hjem|stavning","audio/da-15a19e31bb567c.mp3","audio/da-15a19e31bb567c-ex.mp3"
"fætter","kusin (manlig)","noun","Min fætter bor i Aarhus.","Min kusin (manlig) bor i Århus.","En-ord: 'en fætter'. Danskan könar kusin: fætter = manlig kusin, kusine = kvinnlig.","hjem-og-familie-b1","b1","hjem","audio/da-0f147f1e02f071.mp3","audio/da-0f147f1e02f071-ex.mp3"
"kusine","kusin (kvinnlig)","noun","Jeg skal besøge min kusine.","Jag ska besöka min kusin (kvinnlig).","En-ord: 'en kusine'. Kvinnlig kusin; manlig kusin heter fætter.","hjem-og-familie-b1","b1","hjem","audio/da-1f9d143bc4802e.mp3","audio/da-1f9d143bc4802e-ex.mp3"
"sommerhus","sommarstuga","noun","Vi tager i sommerhus i juli.","Vi åker till sommarstugan i juli.","Et-ord: 'et sommerhus'. Detta (eller 'hytte') är svenskans 'stuga' – INTE 'stue', som betyder vardagsrum.","hjem-og-familie-b1","b1","hjem","audio/da-020f17a9a088e9.mp3","audio/da-020f17a9a088e9-ex.mp3"
"første sal","en trappa upp (våning 1)","phrase","Vi bor på første sal.","Vi bor en trappa upp.","'Sal' = våningsplan. Obs: 'første sal' är EN trappa upp, inte bottenvåningen – den heter 'stueetage'.","hjem-og-familie-b1","b1","hjem|fras","audio/da-0a89661a129df8.mp3","audio/da-0a89661a129df8-ex.mp3"
"gift","gift (äktenskap) / gift (toxin)","other","Hun har været gift i ti år.","Hon har varit gift i tio år.","Dubbeltydigt: adjektivet 'gift' = gift (i äktenskap) OCH substantivet 'en gift' (en-ord) = ett gift/toxin. Förgiftad heter 'forgiftet'.","falske-venner-b2","b1","falsk-ven|asymmetrisk","audio/da-1962c1f7e9f268.mp3","audio/da-1962c1f7e9f268-ex.mp3"
"dyr","djur / dyr","other","Det er et farligt dyr, og det er meget dyrt at holde.","Det är ett farligt djur, och det är mycket dyrt att hålla.","Dubbeltydigt: substantivet 'et dyr' (et-ord) = ett djur, och adjektivet 'dyr' = dyr/kostsam. Sammanhanget avgör.","falske-venner-b2","b1","falsk-ven|asymmetrisk","audio/da-0c2648996a44e0.mp3","audio/da-0c2648996a44e0-ex.mp3"
